[
  {
    "id": "isabelle/sel4",
    "record_version": 1,
    "record_digest": "03d672b659bad37f60e18899eb2bb6045ba7016c485a657e15f77ea723324155",
    "publication": "accepted",
    "approval": {
      "by": "Codex automated bootstrap curation (user-authorized)",
      "date": "2026-10-23",
      "url": "https://github.com/seL4/l4v/blob/3ba5789a044aba2d41afe0b108649132c506f81b/README.md",
      "notes": "Accepted for discovery after inspecting pinned upstream metadata. This is automated catalogue curation, not human semantic review or independent proof checking."
    },
    "freshness": {
      "status": "pinned",
      "checked": "2026-10-23",
      "notes": "Metadata inspected at the pinned revision; newer upstream commits may exist."
    },
    "mechanical": {
      "status": "not_checked_by_us",
      "reference": null,
      "checker": null,
      "source_revision": null,
      "proof_digest": null,
      "axioms": null
    },
    "semantic": {
      "status": "unreviewed",
      "reference": null,
      "qualification": null
    },
    "implementation": {
      "status": "none",
      "reference": null,
      "scope": "No independently evidenced correspondence to a caller implementation."
    }
  },
  {
    "id": "lean/core",
    "record_version": 1,
    "record_digest": "26729e5e75392bf24f4e4efdc49276df84b3d04dfc92fe88b54a71582eda5c4d",
    "publication": "accepted",
    "approval": {
      "by": "Codex automated bootstrap curation (user-authorized)",
      "date": "2026-10-23",
      "url": "https://github.com/leanprover/lean4/blob/eb6cafb7290e8bd5f2937522d8d804f58f02bafc/src/Init/Data/List/Lemmas.lean",
      "notes": "Accepted for discovery after inspecting pinned upstream metadata. This is automated catalogue curation, not human semantic review or independent proof checking."
    },
    "freshness": {
      "status": "pinned",
      "checked": "2026-10-23",
      "notes": "Metadata inspected at the pinned revision; newer upstream commits may exist."
    },
    "mechanical": {
      "status": "not_checked_by_us",
      "reference": null,
      "checker": null,
      "source_revision": null,
      "proof_digest": null,
      "axioms": null
    },
    "semantic": {
      "status": "unreviewed",
      "reference": null,
      "qualification": null
    },
    "implementation": {
      "status": "none",
      "reference": null,
      "scope": "No independently evidenced correspondence to a caller implementation."
    }
  },
  {
    "id": "lean/cslib",
    "record_version": 1,
    "record_digest": "d0f352aa17d4ee6355f37fad04f7b6662998a79e21f066203ceaf28841236f9b",
    "publication": "accepted",
    "approval": {
      "by": "Codex automated bootstrap curation (user-authorized)",
      "date": "2026-10-23",
      "url": "https://github.com/leanprover/cslib/blob/6ff325e870ed89f86be10515f0e7297fa5a32845/README.md",
      "notes": "Accepted for discovery after inspecting pinned upstream metadata. This is automated catalogue curation, not human semantic review or independent proof checking."
    },
    "freshness": {
      "status": "pinned",
      "checked": "2026-10-23",
      "notes": "Metadata inspected at the pinned revision; newer upstream commits may exist."
    },
    "mechanical": {
      "status": "not_checked_by_us",
      "reference": null,
      "checker": null,
      "source_revision": null,
      "proof_digest": null,
      "axioms": null
    },
    "semantic": {
      "status": "unreviewed",
      "reference": null,
      "qualification": null
    },
    "implementation": {
      "status": "none",
      "reference": null,
      "scope": "No independently evidenced correspondence to a caller implementation."
    }
  },
  {
    "id": "lean/list-mem-filter",
    "record_version": 1,
    "record_digest": "2e656f9172382549a29609f1846887e5bbc820243a8f9ef133342f8054a830b3",
    "publication": "accepted",
    "approval": {
      "by": "Codex automated bootstrap curation (user-authorized)",
      "date": "2026-10-23",
      "url": "https://github.com/leanprover/lean4/blob/eb6cafb7290e8bd5f2937522d8d804f58f02bafc/src/Init/Data/List/Lemmas.lean",
      "notes": "Accepted for discovery after inspecting pinned upstream metadata. This is automated catalogue curation, not human semantic review or independent proof checking."
    },
    "freshness": {
      "status": "pinned",
      "checked": "2026-10-23",
      "notes": "Metadata inspected at the pinned revision; newer upstream commits may exist."
    },
    "mechanical": {
      "status": "not_checked_by_us",
      "reference": null,
      "checker": null,
      "source_revision": null,
      "proof_digest": null,
      "axioms": null
    },
    "semantic": {
      "status": "unreviewed",
      "reference": null,
      "qualification": null
    },
    "implementation": {
      "status": "none",
      "reference": null,
      "scope": "No independently evidenced correspondence to a caller implementation."
    }
  },
  {
    "id": "isabelle/sel4",
    "record_version": 2,
    "record_digest": "a0f9b800c6020be07969cd875340700fa23e1f426127ed1528124abd25ab1830",
    "publication": "accepted",
    "approval": {
      "by": "Codex automated curation, user-authorized",
      "date": "2026-10-28",
      "url": "https://github.com/MugiZer/ohara/pull/3",
      "notes": "Source-pinned metadata and retained check evidence reviewed for publication. Semantic assessment remains unreviewed."
    },
    "freshness": {
      "status": "pinned",
      "checked": "2026-10-25",
      "notes": "Source metadata and upstream CI results inspected on 25 October 2026."
    },
    "mechanical": {
      "status": "upstream_reported",
      "reference": {
        "by": "seL4/l4v",
        "date": "2026-10-24",
        "url": "https://github.com/seL4/l4v/actions/runs/40084305451",
        "notes": "Passed upstream Proofs run at this source commit. Successful proof jobs include ARM, ARM_HYP, AARCH64, X64 and RISCV64, with platform-specific jobs listed in the run. MCS jobs were skipped."
      },
      "checker": "Isabelle/HOL via upstream l4v proof jobs",
      "source_revision": "3ba5789a044aba2d41afe0b108649132c506f81b",
      "proof_digest": null,
      "axioms": null
    },
    "semantic": {
      "status": "unreviewed",
      "reference": null,
      "qualification": null
    },
    "implementation": {
      "status": "none",
      "reference": null,
      "scope": "Target implementation: not recorded."
    }
  },
  {
    "id": "lean/core",
    "record_version": 2,
    "record_digest": "56c8dba6f1c7ffbcd24561e052e8acb69188e484407f5817d688d1fba17f8b32",
    "publication": "accepted",
    "approval": {
      "by": "Codex automated curation, user-authorized",
      "date": "2026-10-28",
      "url": "https://github.com/MugiZer/ohara/pull/3",
      "notes": "Source-pinned metadata and retained check evidence reviewed for publication. Semantic assessment remains unreviewed."
    },
    "freshness": {
      "status": "pinned",
      "checked": "2026-10-25",
      "notes": "Source metadata and upstream CI results inspected on 25 October 2026."
    },
    "mechanical": {
      "status": "upstream_reported",
      "reference": {
        "by": "leanprover/lean4",
        "date": "2026-10-12",
        "url": "https://github.com/leanprover/lean4/actions/runs/38273603295",
        "notes": "Passed upstream CI for the v4.35.0 source commit. Build matrix, Linux release build and tests completed successfully; individual job results are available in the run."
      },
      "checker": "Lean 4.35.0 upstream release CI",
      "source_revision": "eb6cafb7290e8bd5f2937522d8d804f58f02bafc",
      "proof_digest": null,
      "axioms": null
    },
    "semantic": {
      "status": "unreviewed",
      "reference": null,
      "qualification": null
    },
    "implementation": {
      "status": "none",
      "reference": null,
      "scope": "Target implementation: not recorded."
    }
  },
  {
    "id": "lean/cslib",
    "record_version": 2,
    "record_digest": "4759115e76c7774c7b20ea529552a8718215df9379404d7f1d13530a0cc0ebf0",
    "publication": "accepted",
    "approval": {
      "by": "Codex automated curation, user-authorized",
      "date": "2026-10-28",
      "url": "https://github.com/MugiZer/ohara/pull/3",
      "notes": "Source-pinned metadata and retained check evidence reviewed for publication. Semantic assessment remains unreviewed."
    },
    "freshness": {
      "status": "pinned",
      "checked": "2026-10-25",
      "notes": "Source metadata and upstream CI results inspected on 25 October 2026."
    },
    "mechanical": {
      "status": "upstream_reported",
      "reference": {
        "by": "leanprover/cslib",
        "date": "2026-10-23",
        "url": "https://github.com/leanprover/cslib/actions/runs/40003829780",
        "notes": "Passed Lean Action CI at this source commit. The ci-checks job ran Lean build/test checks, lake exe mk_all --check and checkInitImports."
      },
      "checker": "Lean 4.36.0-rc1 via leanprover/lean-action@v1",
      "source_revision": "6ff325e870ed89f86be10515f0e7297fa5a32845",
      "proof_digest": null,
      "axioms": null
    },
    "semantic": {
      "status": "unreviewed",
      "reference": null,
      "qualification": null
    },
    "implementation": {
      "status": "none",
      "reference": null,
      "scope": "Target implementation: not recorded."
    }
  },
  {
    "id": "lean/list-mem-filter",
    "record_version": 2,
    "record_digest": "6893a1e94ecdcf5c6b4a6ae193f6a3bd032d776b79b5452c5aa36c622fde04bc",
    "publication": "accepted",
    "approval": {
      "by": "Codex automated curation, user-authorized",
      "date": "2026-10-28",
      "url": "https://github.com/MugiZer/ohara/pull/3",
      "notes": "Source-pinned metadata and retained check evidence reviewed for publication. Semantic assessment remains unreviewed."
    },
    "freshness": {
      "status": "pinned",
      "checked": "2026-10-25",